{"$defs":{"Digest":{"additionalProperties":false,"description":"A content digest with an explicit algorithm.","properties":{"algorithm":{"const":"sha256","default":"sha256","title":"Algorithm","type":"string"},"value":{"pattern":"^[0-9a-f]{64}$","title":"Value","type":"string"}},"required":["value"],"title":"Digest","type":"object"},"SourceManifestEntry":{"additionalProperties":false,"description":"One portable, regular project input in the clean source baseline.","properties":{"digest":{"$ref":"#/$defs/Digest"},"path":{"maxLength":4096,"minLength":1,"title":"Path","type":"string"},"size":{"minimum":0,"title":"Size","type":"integer"}},"required":["path","size","digest"],"title":"SourceManifestEntry","type":"object"}},"$id":"urn:reprobit:schema:source-manifest:3","$schema":"https://json-schema.org/draft/2020-12/schema","additionalProperties":false,"description":"Complete clean-source authority, separate from effective overlays and migration lineage.","properties":{"algorithm":{"const":"portable-source-v1","default":"portable-source-v1","title":"Algorithm","type":"string"},"complete":{"title":"Complete","type":"boolean"},"entries":{"items":{"$ref":"#/$defs/SourceManifestEntry"},"minItems":1,"title":"Entries","type":"array"},"schema_version":{"const":3,"title":"Schema Version","type":"integer"}},"required":["schema_version","complete","entries"],"title":"SourceManifestDocument","type":"object"}
