{"algorithm":"portable-source-v1","complete":true,"entries":[{"digest":{"algorithm":"sha256","value":"66f34ecc9a7f9c8b12f7ba0ac1f8164a3e341de5c0b77708b50357322977d2e8"},"path":"CMakeLists.txt","size":590},{"digest":{"algorithm":"sha256","value":"538446fd8e37d4125f64d0c2244c3c8e1b263ba033431414960600ed4668856d"},"path":"transform_one.cpp","size":452},{"digest":{"algorithm":"sha256","value":"e189126fc9f8dacdb48017b18410e5e33c45f62bf11d9930c05df0e755d5adf5"},"path":"transform_two.cpp","size":452}],"schema_version":3}
