{"algorithm":"portable-source-v1","complete":true,"entries":[{"digest":{"algorithm":"sha256","value":"a9233bbfe654b3617ea04b7e9a5757e9df1334ccc5a830ffaee62b77e9549d80"},"path":"shared.h","size":144},{"digest":{"algorithm":"sha256","value":"e806d816aed0e5c0c342e9b6e737ecb9ae8925c62c3f4c3488cdef9fd932d2e8"},"path":"support.cpp","size":121},{"digest":{"algorithm":"sha256","value":"c33c486903ef648fbd06c115d3aec9980e9e1822d6d3dcd6598584969d886bf7"},"path":"transform.cpp","size":485}],"schema_version":3}
